section_id,message_ar,message_en
7,"يا امرأةً تختصر كل النساء، حبكِ ليس مجرد شعور، بل هو وطنٌ أسكنه وأتنفسه.","O woman who embodies all women, your love is not just a feeling, but a homeland I dwell in and breathe."
7,"حين أحببتكِ، أدركت أن العالم لم يكن كاملاً قبلكِ، وأن كل شيء قبلكِ كان مجرد انتظارٍ لوجودكِ.","When I loved you, I realized the world was incomplete before you, and that everything before you was merely waiting for your presence."
7,أنتِ قصة لا تُقرأ على عجل، بل تُرتل كما تُرتل الآيات، تُعاش بكل تفاصيلها ولا تُختصر.,"You are a story not to be read in haste, but to be recited like sacred verses, lived in every detail and never summarized."
7,كأنكِ الحلم الذي لم أكن أعرف أنني أتمناه، وكأنكِ الإجابة لكل أسئلة قلبي التي لم تُطرح.,"As if you are the dream I never knew I wished for, and the answer to all the unasked questions of my heart."
7,كل الطرق تقودني إليكِ، حتى تلك التي لم أخترها، حتى الأقدار التي لم أطلبها.,"All roads lead me to you, even those I never chose, even the destinies I never asked for."
7,حين أنظر إليكِ، أشعر أن الله خلقكِ لتكوني الدليل القاطع على أن الحب معجزة.,"When I look at you, I feel that God created you to be the undeniable proof that love is a miracle."
7,كل اللغات تنسى مفرداتها حين يتعلق الأمر بكِ، فلا كلمات تكفي، ولا وصف يليق.,"All languages forget their vocabulary when it comes to you; no words are enough, no description is worthy."
7,في عينيكِ تنتهي الحروب، ويهدأ العالم، وفي صوتكِ يُولد السلام من جديد.,"In your eyes, wars end, the world calms, and in your voice, peace is reborn."